{
  "$schema": "../tool-settings-schema.json",
  "title": "Search Products",
  "icons": [
    {
      "source": "https://chillicream.com/favicon-32x32.png",
      "sizes": ["32x32"],
      "mimeType": "image/png",
      "theme": "dark"
    }
  ],
  "annotations": {
    "openWorldHint": false
  },
  "view": {
    "prefersBorder": false
  }
}
